{
  "source_id": "SRC-ARTICLES",
  "held": "held",
  "version": "1",
  "sha256": "76b809a01069ff7d9f42f0ca33b04dbeb0cfaccc2e53cc62229a1c87e1eede56",
  "location": "[ORG]AIOC-SL output socket @ SLM-0600aba3e5d8a927341ce6fe09ff9257309c0448fb6397fedf689cd05a6c284f",
  "snapshot_id": "SLM-0600aba3e5d8a927341ce6fe09ff9257309c0448fb6397fedf689cd05a6c284f",
  "origin_kind": "document",
  "status": "in force",
  "confidentiality": "internal"
}
